{"kind":"rsvp","schema_version":"1","persona":"eliyahu-goldratt-advisor","lens":"constraint/scope","round":"2026-09-27","decision":"JOIN","applies":["delta 1: seven ports with defaults, only one provider bound","delta 2: JSON replies plus Node validator and renderer","delta 7: plugin packaging, install manifest, FC4/FC5, CI"],"expected":{"stakes":"🟡","hook":"seven ports and a CI pipeline for a one-operator tool: which part shortens the review verdict loop?"},"reason":"The PR adds a lot of infrastructure to internal tooling, so someone has to own the cut list."}
