{"kind":"rsvp","schema_version":"1","persona":"mark-richards-architect","lens":"architecture","round":"2026-09-27","decision":"JOIN","applies":["seven ports in CONDUCTOR.md as the chorus/coryphaeus seam","JSON schemas as cross-repo contract","Stage-4 arithmetic authored in GATE-PRIMITIVE and validate.mjs","constitution 2.0.0 runtime-code lift"],"expected":{"stakes":"🔴","hook":"Stage-4 rule now has two authors across two repos, with no parity test"},"reason":"The PR draws a new cross-repo seam, and contracts at seams are the rule I own."}
