{"kind":"rsvp","schema_version":"1","persona":"kent-beck-persona","lens":"tests and simple design","round":"2026-09-27","decision":"JOIN","applies":["coryphaeus validator Stage-4 arithmetic vs GATE-PRIMITIVE prose","63 node tests: behaviour pinned or shape only","FC4/FC5 integrity checks and CI"],"expected":{"stakes":"🟡","hook":"N = P + C + O now has two authors; can any test see them disagree?"},"reason":"Rules moved from prose into a program; whether tests corner that move is my ground."}
