{"kind":"rsvp","schema_version":"1","persona":"uncle-bob-architect","lens":"clean-architecture","round":"2026-09-27","decision":"JOIN","applies":["chorus-core/CONDUCTOR.md seven ports: dependency direction, chorus names no other skill","coryphaeus validate.mjs/render.mjs: SRP of validator with Stage-4 arithmetic","rules moved into DECISION-PRIMITIVE and GATE-PRIMITIVE: responsibility boundaries"],"expected":{"stakes":"🟡","hook":"validator also recomputes Stage-4 arithmetic, so two modules may decide one rule"},"reason":"Ports, dependency inversion and responsibility moves are this lens's home ground."}
