{"kind":"rsvp","schema_version":"1","persona":"delivery-and-ops-advisor","lens":"delivery-and-ops","round":"2026-09-27","decision":"JOIN","applies":["delta 7: install.sh manifest/uninstall, CI, release = dogfooding","delta 2: Node validator as runtime dependency of a Markdown suite","delta 8: coryphaeus local-only repo, 63 tests, no release path"],"expected":{"stakes":"🟡","hook":"release path and rollback for chorus+coryphaeus pairing unpriced; is CI gate real?"},"reason":"New runtime code, installer and CI change what it costs to ship, roll back and run the suite."}
