{"kind":"rsvp","schema_version":"1","persona":"eric-evans-advisor","lens":"ddd","round":"2026-09-27","decision":"JOIN","applies":["CONDUCTOR.md § Ports: chorus/coryphaeus context boundary","coryphaeus decision-to-brief translation rules","severity and verdict vocabularies written by personas, matched by validator"],"expected":{"stakes":"🟡","hook":"one word may mean different things across chorus, schema and brief"},"reason":"The chorus-coryphaeus split creates a new context seam, and I need to check whether its translation and shared vocabulary are explicit."}
