{"kind":"rsvp","schema_version":"1","persona":"alan-cooper-advisor","lens":"user goals and who benefits","round":"2026-09-27","decision":"JOIN","applies":["malformed persona JSON silently counts as ABSTAIN (delta 2)","Cooper/Security Gate A mandate removed (delta 3)","install/uninstall promise to the operator (delta 7)"],"expected":{"stakes":"🟡","hook":"a program-validated JSON contract can drop a seat without telling the solo operator it happened"},"reason":"Who the operator is, and what a rejected reply leaves them able to do, both belong to my lens."}
