{"kind":"rsvp","schema_version":"1","persona":"don-norman-advisor","lens":"human-centered design","round":"2026-09-27","decision":"JOIN","applies":["persona replies and records become JSON checked by validate.mjs: what the operator sees when a reply is malformed and silently counts as ABSTAIN","seven ports with defaults: can the operator tell which binding is active","chorus-review rewrite: advisor() fallback and one failure rule, as operator feedback"],"expected":{"stakes":"🟡","hook":"validator failures that turn into ABSTAIN with no signal open a gulf of evaluation for the operator"},"reason":"The operator's feedback and failure surfaces change in deltas 2, 1 and 5."}
