{"kind":"rsvp","schema_version":"1","persona":"security-and-trust-advisor","lens":"security","round":"2026-09-27","decision":"JOIN","applies":["install.sh writes into ~/.claude and uninstalls by manifest","new GitHub Actions CI supply chain","validate.mjs executes on agent-authored JSON","Security Gate A mandate removed; deferral checklist trust column moved"],"expected":{"stakes":"🟡","hook":"new runtime code and install paths widen the trust boundary"},"reason":"Delta 7 and delta 2 add executable surface, and delta 3 removes the security mandate that guarded it."}
